{
  "$schema": "./rendered-surface-catalog-v1.schema.json",
  "schema_version": "1.0.0",
  "artifact_type": "RENDERED_PARTICIPANT_SURFACE_CATALOG",
  "artifact_id": "INTERP-DIALOGUE-001P0-V1-RENDERED-SURFACES",
  "status": "FROZEN_DERIVED_UNEXECUTED",
  "authority": "EXACT_DELIVERY_BYTES_ONLY_NO_OCCURRENCE_AUTHORITY",
  "participant_surface_binding": {
    "artifact_id": "PARTICIPANT-SURFACE-V1",
    "path": "research/scenarios/interp-dialogue-001/elicitation/p0-v1/participant-surface-v1.json",
    "content_sha256": "4162390948b5d346d4accbdd42286d66bc32c99174a169b3307a1b05b9d5587f"
  },
  "renderer_semantics_version": "INTERP-DIALOGUE-P0-V1-RENDERER-1.0.0",
  "encoding": "BASE64_OF_EXACT_UTF8_BYTES",
  "deliveries": [
    {
      "delivery_surface_id": "DELIVERY-PRES-REL-000-EN-V1",
      "delivery_kind": "INITIAL_PRESENTATION",
      "family_id": "REL-BOUNDARY-001",
      "source_surface_refs": [
        "SURFACE-BASE-REL-BOUNDARY-001",
        "SURFACE-FACTOR-REL-BOUNDARY-001-reported_ordinary_mood",
        "SURFACE-FACTOR-REL-BOUNDARY-001-reliable_followthrough_history",
        "SURFACE-FACTOR-REL-BOUNDARY-001-cue_prior_small_care"
      ],
      "participant_text": "The partner says: I want to be alone for a while today. I will contact you tomorrow.\n\nContext:\n- Just before hearing the partner's request, the recipient says their mood feels ordinary.\n- Across comparable prior boundary requests, this partner usually resumed contact when they said they would.\n- An earlier occasion when the partner noticed a need and followed through is mentioned again.",
      "utf8_base64": "VGhlIHBhcnRuZXIgc2F5czogSSB3YW50IHRvIGJlIGFsb25lIGZvciBhIHdoaWxlIHRvZGF5LiBJIHdpbGwgY29udGFjdCB5b3UgdG9tb3Jyb3cuCgpDb250ZXh0OgotIEp1c3QgYmVmb3JlIGhlYXJpbmcgdGhlIHBhcnRuZXIncyByZXF1ZXN0LCB0aGUgcmVjaXBpZW50IHNheXMgdGhlaXIgbW9vZCBmZWVscyBvcmRpbmFyeS4KLSBBY3Jvc3MgY29tcGFyYWJsZSBwcmlvciBib3VuZGFyeSByZXF1ZXN0cywgdGhpcyBwYXJ0bmVyIHVzdWFsbHkgcmVzdW1lZCBjb250YWN0IHdoZW4gdGhleSBzYWlkIHRoZXkgd291bGQuCi0gQW4gZWFybGllciBvY2Nhc2lvbiB3aGVuIHRoZSBwYXJ0bmVyIG5vdGljZWQgYSBuZWVkIGFuZCBmb2xsb3dlZCB0aHJvdWdoIGlzIG1lbnRpb25lZCBhZ2Fpbi4=",
      "utf8_byte_length": 389,
      "utf8_sha256": "730f518a32df94f2da1d2ae80d8eb2c83287fa01e52123a0fd1aa74cd394194c"
    },
    {
      "delivery_surface_id": "DELIVERY-PRES-REL-001-EN-V1",
      "delivery_kind": "INITIAL_PRESENTATION",
      "family_id": "REL-BOUNDARY-001",
      "source_surface_refs": [
        "SURFACE-BASE-REL-BOUNDARY-001",
        "SURFACE-FACTOR-REL-BOUNDARY-001-reported_ordinary_mood",
        "SURFACE-FACTOR-REL-BOUNDARY-001-reliable_followthrough_history",
        "SURFACE-FACTOR-REL-BOUNDARY-001-cue_prior_unexplained_distance"
      ],
      "participant_text": "The partner says: I want to be alone for a while today. I will contact you tomorrow.\n\nContext:\n- Just before hearing the partner's request, the recipient says their mood feels ordinary.\n- Across comparable prior boundary requests, this partner usually resumed contact when they said they would.\n- An earlier occasion when the partner became distant without explanation is mentioned again.",
      "utf8_base64": "VGhlIHBhcnRuZXIgc2F5czogSSB3YW50IHRvIGJlIGFsb25lIGZvciBhIHdoaWxlIHRvZGF5LiBJIHdpbGwgY29udGFjdCB5b3UgdG9tb3Jyb3cuCgpDb250ZXh0OgotIEp1c3QgYmVmb3JlIGhlYXJpbmcgdGhlIHBhcnRuZXIncyByZXF1ZXN0LCB0aGUgcmVjaXBpZW50IHNheXMgdGhlaXIgbW9vZCBmZWVscyBvcmRpbmFyeS4KLSBBY3Jvc3MgY29tcGFyYWJsZSBwcmlvciBib3VuZGFyeSByZXF1ZXN0cywgdGhpcyBwYXJ0bmVyIHVzdWFsbHkgcmVzdW1lZCBjb250YWN0IHdoZW4gdGhleSBzYWlkIHRoZXkgd291bGQuCi0gQW4gZWFybGllciBvY2Nhc2lvbiB3aGVuIHRoZSBwYXJ0bmVyIGJlY2FtZSBkaXN0YW50IHdpdGhvdXQgZXhwbGFuYXRpb24gaXMgbWVudGlvbmVkIGFnYWluLg==",
      "utf8_byte_length": 388,
      "utf8_sha256": "21e340c94cd7fd20725c9d0aa6a3fa9bbf46916bffd570fc37464731110fb7e0"
    },
    {
      "delivery_surface_id": "DELIVERY-PRES-REL-010-EN-V1",
      "delivery_kind": "INITIAL_PRESENTATION",
      "family_id": "REL-BOUNDARY-001",
      "source_surface_refs": [
        "SURFACE-BASE-REL-BOUNDARY-001",
        "SURFACE-FACTOR-REL-BOUNDARY-001-reported_ordinary_mood",
        "SURFACE-FACTOR-REL-BOUNDARY-001-unexplained_withdrawal_history",
        "SURFACE-FACTOR-REL-BOUNDARY-001-cue_prior_small_care"
      ],
      "participant_text": "The partner says: I want to be alone for a while today. I will contact you tomorrow.\n\nContext:\n- Just before hearing the partner's request, the recipient says their mood feels ordinary.\n- Across comparable prior boundary requests, this partner repeatedly promised later contact and then remained unavailable without explanation.\n- An earlier occasion when the partner noticed a need and followed through is mentioned again.",
      "utf8_base64": "VGhlIHBhcnRuZXIgc2F5czogSSB3YW50IHRvIGJlIGFsb25lIGZvciBhIHdoaWxlIHRvZGF5LiBJIHdpbGwgY29udGFjdCB5b3UgdG9tb3Jyb3cuCgpDb250ZXh0OgotIEp1c3QgYmVmb3JlIGhlYXJpbmcgdGhlIHBhcnRuZXIncyByZXF1ZXN0LCB0aGUgcmVjaXBpZW50IHNheXMgdGhlaXIgbW9vZCBmZWVscyBvcmRpbmFyeS4KLSBBY3Jvc3MgY29tcGFyYWJsZSBwcmlvciBib3VuZGFyeSByZXF1ZXN0cywgdGhpcyBwYXJ0bmVyIHJlcGVhdGVkbHkgcHJvbWlzZWQgbGF0ZXIgY29udGFjdCBhbmQgdGhlbiByZW1haW5lZCB1bmF2YWlsYWJsZSB3aXRob3V0IGV4cGxhbmF0aW9uLgotIEFuIGVhcmxpZXIgb2NjYXNpb24gd2hlbiB0aGUgcGFydG5lciBub3RpY2VkIGEgbmVlZCBhbmQgZm9sbG93ZWQgdGhyb3VnaCBpcyBtZW50aW9uZWQgYWdhaW4u",
      "utf8_byte_length": 423,
      "utf8_sha256": "219019153f06ba1b267d93eb86e028d1bdd8a21c8b12e3edd6f825575a8598a6"
    },
    {
      "delivery_surface_id": "DELIVERY-PRES-REL-011-EN-V1",
      "delivery_kind": "INITIAL_PRESENTATION",
      "family_id": "REL-BOUNDARY-001",
      "source_surface_refs": [
        "SURFACE-BASE-REL-BOUNDARY-001",
        "SURFACE-FACTOR-REL-BOUNDARY-001-reported_ordinary_mood",
        "SURFACE-FACTOR-REL-BOUNDARY-001-unexplained_withdrawal_history",
        "SURFACE-FACTOR-REL-BOUNDARY-001-cue_prior_unexplained_distance"
      ],
      "participant_text": "The partner says: I want to be alone for a while today. I will contact you tomorrow.\n\nContext:\n- Just before hearing the partner's request, the recipient says their mood feels ordinary.\n- Across comparable prior boundary requests, this partner repeatedly promised later contact and then remained unavailable without explanation.\n- An earlier occasion when the partner became distant without explanation is mentioned again.",
      "utf8_base64": "VGhlIHBhcnRuZXIgc2F5czogSSB3YW50IHRvIGJlIGFsb25lIGZvciBhIHdoaWxlIHRvZGF5LiBJIHdpbGwgY29udGFjdCB5b3UgdG9tb3Jyb3cuCgpDb250ZXh0OgotIEp1c3QgYmVmb3JlIGhlYXJpbmcgdGhlIHBhcnRuZXIncyByZXF1ZXN0LCB0aGUgcmVjaXBpZW50IHNheXMgdGhlaXIgbW9vZCBmZWVscyBvcmRpbmFyeS4KLSBBY3Jvc3MgY29tcGFyYWJsZSBwcmlvciBib3VuZGFyeSByZXF1ZXN0cywgdGhpcyBwYXJ0bmVyIHJlcGVhdGVkbHkgcHJvbWlzZWQgbGF0ZXIgY29udGFjdCBhbmQgdGhlbiByZW1haW5lZCB1bmF2YWlsYWJsZSB3aXRob3V0IGV4cGxhbmF0aW9uLgotIEFuIGVhcmxpZXIgb2NjYXNpb24gd2hlbiB0aGUgcGFydG5lciBiZWNhbWUgZGlzdGFudCB3aXRob3V0IGV4cGxhbmF0aW9uIGlzIG1lbnRpb25lZCBhZ2Fpbi4=",
      "utf8_byte_length": 422,
      "utf8_sha256": "47f203d6c84bedb8672f6f6eb2b8b476542af9ed41a58ae66a52f530e90b0bd5"
    },
    {
      "delivery_surface_id": "DELIVERY-PRES-REL-100-EN-V1",
      "delivery_kind": "INITIAL_PRESENTATION",
      "family_id": "REL-BOUNDARY-001",
      "source_surface_refs": [
        "SURFACE-BASE-REL-BOUNDARY-001",
        "SURFACE-FACTOR-REL-BOUNDARY-001-reported_low_mood",
        "SURFACE-FACTOR-REL-BOUNDARY-001-reliable_followthrough_history",
        "SURFACE-FACTOR-REL-BOUNDARY-001-cue_prior_small_care"
      ],
      "participant_text": "The partner says: I want to be alone for a while today. I will contact you tomorrow.\n\nContext:\n- Just before hearing the partner's request, the recipient says their mood feels low.\n- Across comparable prior boundary requests, this partner usually resumed contact when they said they would.\n- An earlier occasion when the partner noticed a need and followed through is mentioned again.",
      "utf8_base64": "VGhlIHBhcnRuZXIgc2F5czogSSB3YW50IHRvIGJlIGFsb25lIGZvciBhIHdoaWxlIHRvZGF5LiBJIHdpbGwgY29udGFjdCB5b3UgdG9tb3Jyb3cuCgpDb250ZXh0OgotIEp1c3QgYmVmb3JlIGhlYXJpbmcgdGhlIHBhcnRuZXIncyByZXF1ZXN0LCB0aGUgcmVjaXBpZW50IHNheXMgdGhlaXIgbW9vZCBmZWVscyBsb3cuCi0gQWNyb3NzIGNvbXBhcmFibGUgcHJpb3IgYm91bmRhcnkgcmVxdWVzdHMsIHRoaXMgcGFydG5lciB1c3VhbGx5IHJlc3VtZWQgY29udGFjdCB3aGVuIHRoZXkgc2FpZCB0aGV5IHdvdWxkLgotIEFuIGVhcmxpZXIgb2NjYXNpb24gd2hlbiB0aGUgcGFydG5lciBub3RpY2VkIGEgbmVlZCBhbmQgZm9sbG93ZWQgdGhyb3VnaCBpcyBtZW50aW9uZWQgYWdhaW4u",
      "utf8_byte_length": 384,
      "utf8_sha256": "37dba63ae815e04dd8a908637a55f81ee6017e80c94ebb7db288a5e09f625c65"
    },
    {
      "delivery_surface_id": "DELIVERY-PRES-REL-101-EN-V1",
      "delivery_kind": "INITIAL_PRESENTATION",
      "family_id": "REL-BOUNDARY-001",
      "source_surface_refs": [
        "SURFACE-BASE-REL-BOUNDARY-001",
        "SURFACE-FACTOR-REL-BOUNDARY-001-reported_low_mood",
        "SURFACE-FACTOR-REL-BOUNDARY-001-reliable_followthrough_history",
        "SURFACE-FACTOR-REL-BOUNDARY-001-cue_prior_unexplained_distance"
      ],
      "participant_text": "The partner says: I want to be alone for a while today. I will contact you tomorrow.\n\nContext:\n- Just before hearing the partner's request, the recipient says their mood feels low.\n- Across comparable prior boundary requests, this partner usually resumed contact when they said they would.\n- An earlier occasion when the partner became distant without explanation is mentioned again.",
      "utf8_base64": "VGhlIHBhcnRuZXIgc2F5czogSSB3YW50IHRvIGJlIGFsb25lIGZvciBhIHdoaWxlIHRvZGF5LiBJIHdpbGwgY29udGFjdCB5b3UgdG9tb3Jyb3cuCgpDb250ZXh0OgotIEp1c3QgYmVmb3JlIGhlYXJpbmcgdGhlIHBhcnRuZXIncyByZXF1ZXN0LCB0aGUgcmVjaXBpZW50IHNheXMgdGhlaXIgbW9vZCBmZWVscyBsb3cuCi0gQWNyb3NzIGNvbXBhcmFibGUgcHJpb3IgYm91bmRhcnkgcmVxdWVzdHMsIHRoaXMgcGFydG5lciB1c3VhbGx5IHJlc3VtZWQgY29udGFjdCB3aGVuIHRoZXkgc2FpZCB0aGV5IHdvdWxkLgotIEFuIGVhcmxpZXIgb2NjYXNpb24gd2hlbiB0aGUgcGFydG5lciBiZWNhbWUgZGlzdGFudCB3aXRob3V0IGV4cGxhbmF0aW9uIGlzIG1lbnRpb25lZCBhZ2Fpbi4=",
      "utf8_byte_length": 383,